{
  "schema": "urn:algaguard:schema:onboarding:credential-health:v1",
  "schemaVersion": "1.0.0",
  "deviceUuid": "aaaaaaaa-aaaa-4aaa-8aaa-aaaaaaaaaaaa",
  "deviceId": "AG-000001",
  "observedAt": "2026-07-24T01:01:03Z",
  "credentialStatus": "ACTIVE",
  "activeCredentialId": "55555555-5555-4555-8555-555555555555",
  "certificateExpiresAt": "2026-10-22T01:00:30Z",
  "rotationRequired": false,
  "brokerAuthentication": "VALID",
  "recoveryRequired": false
}
